{
  "schema_version": "agent-dispatch.dead-letter-record/v1",
  "dispatch_id": "019c2345-6789-7abc-9def-0123456789ab",
  "route_id": "wiki-maintenance",
  "target_id": "hermes-kanban-main",
  "idempotency_key": "agent-dispatch:v1:sha256:eeeeeeeeeeeeeeeeeeeeeeeeeeeeeeeeeeeeeeeeeeeeeeeeeeeeeeeeeeeeeeee",
  "state": "dead_lettered",
  "generation": 1,
  "attempt_count": 3,
  "dead_letter_reason": "unresolved_or_limit_reached",
  "attempts": [
    {
      "schema_version": "agent-dispatch.dispatch-attempt/v1",
      "attempt_id": "019c2345-6789-7abc-9def-0123456789ab-1787220000000000000",
      "dispatch_id": "019c2345-6789-7abc-9def-0123456789ab",
      "lease_owner": "agent-dispatch-dispatch-pid-821",
      "started_at": "2026-08-20T01:00:00Z",
      "completed_at": "2026-08-20T01:00:31Z",
      "outcome": "unknown",
      "error_code": null,
      "response_digest": null,
      "diagnostic": "submit deadline exceeded after possible submission"
    }
  ],
  "external_ref": null,
  "created_at": "2026-08-20T01:00:00Z",
  "operator_actions": ["retry", "reprocess", "rerun", "discard"]
}
